NAME="CentOS Linux"
VERSION="7 (Core)"
ID="centos"
ID_LIKE="rhel fedora"
VERSION_ID="7"
PRETTY_NAME="CentOS Linux 7 (Core)"
ANSI_COLOR="0;31"
CPE_NAME="cpe:/o:centos:centos:7"
HOME_URL="https://www.centos.org/"
BUG_REPORT_URL="https://bugs.centos.org/"

CENTOS_MANTISBT_PROJECT="CentOS-7"
CENTOS_MANTISBT_PROJECT_VERSION="7"
REDHAT_SUPPORT_PRODUCT="centos"
REDHAT_SUPPORT_PRODUCT_VERSION="7"

==============================================

4.19.0
==============================================

Node             SN                   Model                                    Namespace Usage                      Format           FW Rev  
---------------- -------------------- ---------------------------------------- --------- -------------------------- ---------------- --------
/dev/nvme0n1     PHLF812502XM1P0GGN   INTEL SSDPE2KX010T7                      1           1.00  TB /   1.00  TB      4 KiB +  0 B   QDV10170
/dev/nvme1n1     PHLF812503NF1P0GGN   INTEL SSDPE2KX010T7                      1           1.00  TB /   1.00  TB      4 KiB +  0 B   QDV10170
/dev/nvme2n1     PHLF812503NX1P0GGN   INTEL SSDPE2KX010T7                      1           1.00  TB /   1.00  TB    512   B +  0 B   QDV10170
/dev/nvme3n1     PHLF8125013L1P0GGN   INTEL SSDPE2KX010T7                      1           1.00  TB /   1.00  TB    512   B +  0 B   QDV10170
==============================================

NAME        MAJ:MIN RM          SIZE RO TYPE   MOUNTPOINT
nvme0n1     259:6    0 1000204886016  0 disk   
└─nvme0n1p1 259:7    0 1000203837440  0 part   
  └─md10      9:10   0 1000068349952  0 raid10 
sdd           8:48   0  480103981056  0 disk   
└─sdd1        8:49   0  480102932480  0 part   
nvme3n1     259:1    0 1000204886016  0 disk   
└─nvme3n1p1 259:4    0 1000203837440  0 part   
  └─md1       9:1    0 1000068546560  0 raid1  
sdb           8:16   0  480103981056  0 disk   
└─sdb1        8:17   0  480102932480  0 part   
nvme2n1     259:0    0 1000204886016  0 disk   
└─nvme2n1p1 259:5    0 1000203837440  0 part   
  └─md1       9:1    0 1000068546560  0 raid1  
sde           8:64   0 2000398934016  0 disk   
├─sde2        8:66   0    8389656576  0 part   [SWAP]
├─sde3        8:67   0 1990931251200  0 part   /
└─sde1        8:65   0    1073741824  0 part   /boot
sdc           8:32   0  480103981056  0 disk   
└─sdc1        8:33   0  480102932480  0 part   
nvme1n1     259:2    0 1000204886016  0 disk   
└─nvme1n1p1 259:8    0 1000203837440  0 part   
  └─md10      9:10   0 1000068349952  0 raid10 
sda           8:0    0  480103981056  0 disk   
└─sda1        8:1    0  480102932480  0 part   
==============================================


Disk /dev/sda: 480.1 GB, 480103981056 bytes, 937703088 sectors
Units = sectors of 1 * 512 = 512 bytes
Sector size (logical/physical): 512 bytes / 512 bytes
I/O size (minimum/optimal): 512 bytes / 512 bytes
Disk label type: dos
Disk identifier: 0xe60e9bd6

   Device Boot      Start         End      Blocks   Id  System
/dev/sda1            2048   937703087   468850520   fd  Linux raid autodetect

Disk /dev/sdb: 480.1 GB, 480103981056 bytes, 937703088 sectors
Units = sectors of 1 * 512 = 512 bytes
Sector size (logical/physical): 512 bytes / 512 bytes
I/O size (minimum/optimal): 512 bytes / 512 bytes
Disk label type: dos
Disk identifier: 0x000b9b6c

   Device Boot      Start         End      Blocks   Id  System
/dev/sdb1            2048   937703087   468850520   fd  Linux raid autodetect

Disk /dev/sdc: 480.1 GB, 480103981056 bytes, 937703088 sectors
Units = sectors of 1 * 512 = 512 bytes
Sector size (logical/physical): 512 bytes / 512 bytes
I/O size (minimum/optimal): 512 bytes / 512 bytes
Disk label type: dos
Disk identifier: 0x7a34a072

   Device Boot      Start         End      Blocks   Id  System
/dev/sdc1            2048   937703087   468850520   fd  Linux raid autodetect

Disk /dev/sdd: 480.1 GB, 480103981056 bytes, 937703088 sectors
Units = sectors of 1 * 512 = 512 bytes
Sector size (logical/physical): 512 bytes / 512 bytes
I/O size (minimum/optimal): 512 bytes / 512 bytes
Disk label type: dos
Disk identifier: 0xf4f00082

   Device Boot      Start         End      Blocks   Id  System
/dev/sdd1            2048   937703087   468850520   fd  Linux raid autodetect

Disk /dev/sde: 2000.4 GB, 2000398934016 bytes, 3907029168 sectors
Units = sectors of 1 * 512 = 512 bytes
Sector size (logical/physical): 512 bytes / 4096 bytes
I/O size (minimum/optimal): 4096 bytes / 4096 bytes
Disk label type: dos
Disk identifier: 0x000e0de7

   Device Boot      Start         End      Blocks   Id  System
/dev/sde1   *        2048     2099199     1048576   83  Linux
/dev/sde2         2099200    18485247     8193024   82  Linux swap / Solaris
/dev/sde3        18485248  3907022847  1944268800   83  Linux

Disk /dev/nvme2n1: 1000.2 GB, 1000204886016 bytes, 1953525168 sectors
Units = sectors of 1 * 512 = 512 bytes
Sector size (logical/physical): 512 bytes / 512 bytes
I/O size (minimum/optimal): 512 bytes / 512 bytes
Disk label type: dos
Disk identifier: 0x00000000

        Device Boot      Start         End      Blocks   Id  System
/dev/nvme2n1p1            2048  1953525167   976761560   fd  Linux raid autodetect

Disk /dev/nvme1n1: 1000.2 GB, 1000204886016 bytes, 244190646 sectors
Units = sectors of 1 * 4096 = 4096 bytes
Sector size (logical/physical): 4096 bytes / 4096 bytes
I/O size (minimum/optimal): 4096 bytes / 4096 bytes
Disk label type: dos
Disk identifier: 0x5fb9c12f

        Device Boot      Start         End      Blocks   Id  System
/dev/nvme1n1p1             256   244190645   976761560   fd  Linux raid autodetect

Disk /dev/nvme3n1: 1000.2 GB, 1000204886016 bytes, 1953525168 sectors
Units = sectors of 1 * 512 = 512 bytes
Sector size (logical/physical): 512 bytes / 512 bytes
I/O size (minimum/optimal): 512 bytes / 512 bytes
Disk label type: dos
Disk identifier: 0x6f17a7fd

        Device Boot      Start         End      Blocks   Id  System
/dev/nvme3n1p1            2048  1953525167   976761560   fd  Linux raid autodetect

Disk /dev/nvme0n1: 1000.2 GB, 1000204886016 bytes, 244190646 sectors
Units = sectors of 1 * 4096 = 4096 bytes
Sector size (logical/physical): 4096 bytes / 4096 bytes
I/O size (minimum/optimal): 4096 bytes / 4096 bytes
Disk label type: dos
Disk identifier: 0x32f4e63f

        Device Boot      Start         End      Blocks   Id  System
/dev/nvme0n1p1             256   244190645   976761560   fd  Linux raid autodetect

Disk /dev/md1: 1000.1 GB, 1000068546560 bytes, 1953258880 sectors
Units = sectors of 1 * 512 = 512 bytes
Sector size (logical/physical): 512 bytes / 512 bytes
I/O size (minimum/optimal): 512 bytes / 512 bytes


Disk /dev/md10: 1000.1 GB, 1000068349952 bytes, 244157312 sectors
Units = sectors of 1 * 4096 = 4096 bytes
Sector size (logical/physical): 4096 bytes / 4096 bytes
I/O size (minimum/optimal): 524288 bytes / 524288 bytes

==============================================

==============================================

==============================================

==============================================

====================host=================
+++++++++++++++++++++/dev/nvme0++++++++++++++++++
smartctl 6.7 2018-09-16 r4783 [x86_64-linux-4.19.0] (local build)
Copyright (C) 2002-18, Bruce Allen, Christian Franke, www.smartmontools.org

=== START OF INFORMATION SECTION ===
Model Number:                       INTEL SSDPE2KX010T7
Serial Number:                      PHLF812502XM1P0GGN
Firmware Version:                   QDV10170
PCI Vendor/Subsystem ID:            0x8086
IEEE OUI Identifier:                0x5cd2e4
Total NVM Capacity:                 1,000,204,886,016 [1.00 TB]
Unallocated NVM Capacity:           0
Controller ID:                      0
Number of Namespaces:               1
Namespace 1 Size/Capacity:          1,000,204,886,016 [1.00 TB]
Namespace 1 Formatted LBA Size:     4096
Namespace 1 IEEE EUI-64:            5cd2e4 874f270100
Local Time is:                      Fri Oct 26 14:29:40 2018 KST
Firmware Updates (0x02):            1 Slot
Optional Admin Commands (0x0006):   Format Frmw_DL
Optional NVM Commands (0x0006):     Wr_Unc DS_Mngmt
Maximum Data Transfer Size:         32 Pages
Warning  Comp. Temp. Threshold:     70 Celsius
Critical Comp. Temp. Threshold:     79 Celsius

Supported Power States
St Op     Max   Active     Idle   RL RT WL WT  Ent_Lat  Ex_Lat
 0 +    25.00W       -        -    0  0  0  0        0       0

Supported LBA Sizes (NSID 0x1)
Id Fmt  Data  Metadt  Rel_Perf
 0 -     512       0         2
 1 +    4096       0         0

=== START OF SMART DATA SECTION ===
SMART overall-health self-assessment test result: PASSED

SMART/Health Information (NVMe Log 0x02, NSID 0xffffffff)
Critical Warning:                   0x00
Temperature:                        43 Celsius
Available Spare:                    100%
Available Spare Threshold:          10%
Percentage Used:                    0%
Data Units Read:                    22,747,266 [11.6 TB]
Data Units Written:                 19,848,541 [10.1 TB]
Host Read Commands:                 1,296,257,823
Host Write Commands:                1,291,623,266
Controller Busy Time:               378
Power Cycles:                       64
Power On Hours:                     1,759
Unsafe Shutdowns:                   53
Media and Data Integrity Errors:    0
Error Information Log Entries:      0
Warning  Comp. Temperature Time:    156
Critical Comp. Temperature Time:    0

Error Information (NVMe Log 0x01, max 64 entries)
No Errors Logged

+++++++++++++++++++++/dev/nvme1++++++++++++++++++
smartctl 6.7 2018-09-16 r4783 [x86_64-linux-4.19.0] (local build)
Copyright (C) 2002-18, Bruce Allen, Christian Franke, www.smartmontools.org

=== START OF INFORMATION SECTION ===
Model Number:                       INTEL SSDPE2KX010T7
Serial Number:                      PHLF812503NF1P0GGN
Firmware Version:                   QDV10170
PCI Vendor/Subsystem ID:            0x8086
IEEE OUI Identifier:                0x5cd2e4
Total NVM Capacity:                 1,000,204,886,016 [1.00 TB]
Unallocated NVM Capacity:           0
Controller ID:                      0
Number of Namespaces:               1
Namespace 1 Size/Capacity:          1,000,204,886,016 [1.00 TB]
Namespace 1 Formatted LBA Size:     4096
Namespace 1 IEEE EUI-64:            5cd2e4 844e270100
Local Time is:                      Fri Oct 26 14:29:40 2018 KST
Firmware Updates (0x02):            1 Slot
Optional Admin Commands (0x0006):   Format Frmw_DL
Optional NVM Commands (0x0006):     Wr_Unc DS_Mngmt
Maximum Data Transfer Size:         32 Pages
Warning  Comp. Temp. Threshold:     70 Celsius
Critical Comp. Temp. Threshold:     79 Celsius

Supported Power States
St Op     Max   Active     Idle   RL RT WL WT  Ent_Lat  Ex_Lat
 0 +    25.00W       -        -    0  0  0  0        0       0

Supported LBA Sizes (NSID 0x1)
Id Fmt  Data  Metadt  Rel_Perf
 0 -     512       0         2
 1 +    4096       0         0

=== START OF SMART DATA SECTION ===
SMART overall-health self-assessment test result: PASSED

SMART/Health Information (NVMe Log 0x02, NSID 0xffffffff)
Critical Warning:                   0x00
Temperature:                        43 Celsius
Available Spare:                    100%
Available Spare Threshold:          10%
Percentage Used:                    0%
Data Units Read:                    4,034,726 [2.06 TB]
Data Units Written:                 10,643,751 [5.44 TB]
Host Read Commands:                 83,905,701
Host Write Commands:                227,892,236
Controller Busy Time:               159
Power Cycles:                       70
Power On Hours:                     1,758
Unsafe Shutdowns:                   58
Media and Data Integrity Errors:    0
Error Information Log Entries:      0
Warning  Comp. Temperature Time:    0
Critical Comp. Temperature Time:    0

Error Information (NVMe Log 0x01, max 64 entries)
No Errors Logged

+++++++++++++++++++++/dev/nvme2++++++++++++++++++
smartctl 6.7 2018-09-16 r4783 [x86_64-linux-4.19.0] (local build)
Copyright (C) 2002-18, Bruce Allen, Christian Franke, www.smartmontools.org

=== START OF INFORMATION SECTION ===
Model Number:                       INTEL SSDPE2KX010T7
Serial Number:                      PHLF812503NX1P0GGN
Firmware Version:                   QDV10170
PCI Vendor/Subsystem ID:            0x8086
IEEE OUI Identifier:                0x5cd2e4
Total NVM Capacity:                 1,000,204,886,016 [1.00 TB]
Unallocated NVM Capacity:           0
Controller ID:                      0
Number of Namespaces:               1
Namespace 1 Size/Capacity:          1,000,204,886,016 [1.00 TB]
Namespace 1 Formatted LBA Size:     512
Namespace 1 IEEE EUI-64:            5cd2e4 944e270100
Local Time is:                      Fri Oct 26 14:29:40 2018 KST
Firmware Updates (0x02):            1 Slot
Optional Admin Commands (0x0006):   Format Frmw_DL
Optional NVM Commands (0x0006):     Wr_Unc DS_Mngmt
Maximum Data Transfer Size:         32 Pages
Warning  Comp. Temp. Threshold:     70 Celsius
Critical Comp. Temp. Threshold:     79 Celsius

Supported Power States
St Op     Max   Active     Idle   RL RT WL WT  Ent_Lat  Ex_Lat
 0 +    25.00W       -        -    0  0  0  0        0       0

Supported LBA Sizes (NSID 0x1)
Id Fmt  Data  Metadt  Rel_Perf
 0 +     512       0         2
 1 -    4096       0         0

=== START OF SMART DATA SECTION ===
SMART overall-health self-assessment test result: PASSED

SMART/Health Information (NVMe Log 0x02, NSID 0xffffffff)
Critical Warning:                   0x00
Temperature:                        42 Celsius
Available Spare:                    100%
Available Spare Threshold:          10%
Percentage Used:                    0%
Data Units Read:                    4,383,968 [2.24 TB]
Data Units Written:                 4,500,124 [2.30 TB]
Host Read Commands:                 67,501,992
Host Write Commands:                122,832,777
Controller Busy Time:               39
Power Cycles:                       69
Power On Hours:                     1,759
Unsafe Shutdowns:                   51
Media and Data Integrity Errors:    0
Error Information Log Entries:      0
Warning  Comp. Temperature Time:    0
Critical Comp. Temperature Time:    0

Error Information (NVMe Log 0x01, max 64 entries)
No Errors Logged

+++++++++++++++++++++/dev/nvme3++++++++++++++++++
smartctl 6.7 2018-09-16 r4783 [x86_64-linux-4.19.0] (local build)
Copyright (C) 2002-18, Bruce Allen, Christian Franke, www.smartmontools.org

=== START OF INFORMATION SECTION ===
Model Number:                       INTEL SSDPE2KX010T7
Serial Number:                      PHLF8125013L1P0GGN
Firmware Version:                   QDV10170
PCI Vendor/Subsystem ID:            0x8086
IEEE OUI Identifier:                0x5cd2e4
Total NVM Capacity:                 1,000,204,886,016 [1.00 TB]
Unallocated NVM Capacity:           0
Controller ID:                      0
Number of Namespaces:               1
Namespace 1 Size/Capacity:          1,000,204,886,016 [1.00 TB]
Namespace 1 Formatted LBA Size:     512
Namespace 1 IEEE EUI-64:            5cd2e4 b802270100
Local Time is:                      Fri Oct 26 14:29:40 2018 KST
Firmware Updates (0x02):            1 Slot
Optional Admin Commands (0x0006):   Format Frmw_DL
Optional NVM Commands (0x0006):     Wr_Unc DS_Mngmt
Maximum Data Transfer Size:         32 Pages
Warning  Comp. Temp. Threshold:     70 Celsius
Critical Comp. Temp. Threshold:     79 Celsius

Supported Power States
St Op     Max   Active     Idle   RL RT WL WT  Ent_Lat  Ex_Lat
 0 +    25.00W       -        -    0  0  0  0        0       0

Supported LBA Sizes (NSID 0x1)
Id Fmt  Data  Metadt  Rel_Perf
 0 +     512       0         2
 1 -    4096       0         0

=== START OF SMART DATA SECTION ===
SMART overall-health self-assessment test result: PASSED

SMART/Health Information (NVMe Log 0x02, NSID 0xffffffff)
Critical Warning:                   0x00
Temperature:                        39 Celsius
Available Spare:                    100%
Available Spare Threshold:          10%
Percentage Used:                    0%
Data Units Read:                    7,401,095 [3.78 TB]
Data Units Written:                 2,844,339 [1.45 TB]
Host Read Commands:                 235,963,949
Host Write Commands:                122,208,383
Controller Busy Time:               39
Power Cycles:                       69
Power On Hours:                     1,759
Unsafe Shutdowns:                   47
Media and Data Integrity Errors:    0
Error Information Log Entries:      0
Warning  Comp. Temperature Time:    0
Critical Comp. Temperature Time:    0

Error Information (NVMe Log 0x01, max 64 entries)
No Errors Logged

